{
  "schema_version": "1",
  "config_id": "gcs_rk_metadata370",
  "event_semantics": "set_v1",
  "columns": [
    {
      "name": "origin_detail_detail",
      "position": 0,
      "dtype": "bool",
      "formula": "eq:model-source-rank: membership(detail_detail)",
      "mask": null,
      "transformation": "identity",
      "provenance": {
        "entity": "request_item",
        "sources": [
          "prefix",
          "A_G"
        ],
        "available_at": "event_time <= t_q and available_time <= a_q; snapshot_time_ms < t_q",
        "version": "e3_v1",
        "missing_rule": "defined"
      },
      "fit_period": "A_G"
    },
    {
      "name": "score_detail_detail",
      "position": 1,
      "dtype": "float64",
      "formula": "eq:model-graph-score",
      "mask": "score_detail_detail_mask",
      "transformation": "identity",
      "provenance": {
        "entity": "request_item",
        "sources": [
          "prefix",
          "A_G"
        ],
        "available_at": "event_time <= t_q and available_time <= a_q; snapshot_time_ms < t_q",
        "version": "e3_v1",
        "missing_rule": "zero_with_mask"
      },
      "fit_period": "A_G"
    },
    {
      "name": "score_detail_detail_mask",
      "position": 2,
      "dtype": "bool",
      "formula": "availability(score_detail_detail)",
      "mask": null,
      "transformation": "identity",
      "provenance": {
        "entity": "request_item",
        "sources": [
          "prefix",
          "A_G"
        ],
        "available_at": "event_time <= t_q and available_time <= a_q; snapshot_time_ms < t_q",
        "version": "e3_v1",
        "missing_rule": "defined"
      },
      "fit_period": "A_G"
    },
    {
      "name": "rank_detail_detail",
      "position": 3,
      "dtype": "float64",
      "formula": "eq:model-source-rank: 1/(1+rank), rank starts at 1",
      "mask": "rank_detail_detail_mask",
      "transformation": "identity",
      "provenance": {
        "entity": "request_item",
        "sources": [
          "prefix",
          "A_G"
        ],
        "available_at": "event_time <= t_q and available_time <= a_q; snapshot_time_ms < t_q",
        "version": "e3_v1",
        "missing_rule": "zero_with_mask"
      },
      "fit_period": "A_G"
    },
    {
      "name": "rank_detail_detail_mask",
      "position": 4,
      "dtype": "bool",
      "formula": "availability(rank_detail_detail)",
      "mask": null,
      "transformation": "identity",
      "provenance": {
        "entity": "request_item",
        "sources": [
          "prefix",
          "A_G"
        ],
        "available_at": "event_time <= t_q and available_time <= a_q; snapshot_time_ms < t_q",
        "version": "e3_v1",
        "missing_rule": "defined"
      },
      "fit_period": "A_G"
    },
    {
      "name": "origin_detail_add",
      "position": 5,
      "dtype": "bool",
      "formula": "eq:model-source-rank: membership(detail_add)",
      "mask": null,
      "transformation": "identity",
      "provenance": {
        "entity": "request_item",
        "sources": [
          "prefix",
          "A_G"
        ],
        "available_at": "event_time <= t_q and available_time <= a_q; snapshot_time_ms < t_q",
        "version": "e3_v1",
        "missing_rule": "defined"
      },
      "fit_period": "A_G"
    },
    {
      "name": "score_detail_add",
      "position": 6,
      "dtype": "float64",
      "formula": "eq:model-graph-score",
      "mask": "score_detail_add_mask",
      "transformation": "identity",
      "provenance": {
        "entity": "request_item",
        "sources": [
          "prefix",
          "A_G"
        ],
        "available_at": "event_time <= t_q and available_time <= a_q; snapshot_time_ms < t_q",
        "version": "e3_v1",
        "missing_rule": "zero_with_mask"
      },
      "fit_period": "A_G"
    },
    {
      "name": "score_detail_add_mask",
      "position": 7,
      "dtype": "bool",
      "formula": "availability(score_detail_add)",
      "mask": null,
      "transformation": "identity",
      "provenance": {
        "entity": "request_item",
        "sources": [
          "prefix",
          "A_G"
        ],
        "available_at": "event_time <= t_q and available_time <= a_q; snapshot_time_ms < t_q",
        "version": "e3_v1",
        "missing_rule": "defined"
      },
      "fit_period": "A_G"
    },
    {
      "name": "rank_detail_add",
      "position": 8,
      "dtype": "float64",
      "formula": "eq:model-source-rank: 1/(1+rank), rank starts at 1",
      "mask": "rank_detail_add_mask",
      "transformation": "identity",
      "provenance": {
        "entity": "request_item",
        "sources": [
          "prefix",
          "A_G"
        ],
        "available_at": "event_time <= t_q and available_time <= a_q; snapshot_time_ms < t_q",
        "version": "e3_v1",
        "missing_rule": "zero_with_mask"
      },
      "fit_period": "A_G"
    },
    {
      "name": "rank_detail_add_mask",
      "position": 9,
      "dtype": "bool",
      "formula": "availability(rank_detail_add)",
      "mask": null,
      "transformation": "identity",
      "provenance": {
        "entity": "request_item",
        "sources": [
          "prefix",
          "A_G"
        ],
        "available_at": "event_time <= t_q and available_time <= a_q; snapshot_time_ms < t_q",
        "version": "e3_v1",
        "missing_rule": "defined"
      },
      "fit_period": "A_G"
    },
    {
      "name": "origin_detail_purchase",
      "position": 10,
      "dtype": "bool",
      "formula": "eq:model-source-rank: membership(detail_purchase)",
      "mask": null,
      "transformation": "identity",
      "provenance": {
        "entity": "request_item",
        "sources": [
          "prefix",
          "A_G"
        ],
        "available_at": "event_time <= t_q and available_time <= a_q; snapshot_time_ms < t_q",
        "version": "e3_v1",
        "missing_rule": "defined"
      },
      "fit_period": "A_G"
    },
    {
      "name": "score_detail_purchase",
      "position": 11,
      "dtype": "float64",
      "formula": "eq:model-graph-score",
      "mask": "score_detail_purchase_mask",
      "transformation": "identity",
      "provenance": {
        "entity": "request_item",
        "sources": [
          "prefix",
          "A_G"
        ],
        "available_at": "event_time <= t_q and available_time <= a_q; snapshot_time_ms < t_q",
        "version": "e3_v1",
        "missing_rule": "zero_with_mask"
      },
      "fit_period": "A_G"
    },
    {
      "name": "score_detail_purchase_mask",
      "position": 12,
      "dtype": "bool",
      "formula": "availability(score_detail_purchase)",
      "mask": null,
      "transformation": "identity",
      "provenance": {
        "entity": "request_item",
        "sources": [
          "prefix",
          "A_G"
        ],
        "available_at": "event_time <= t_q and available_time <= a_q; snapshot_time_ms < t_q",
        "version": "e3_v1",
        "missing_rule": "defined"
      },
      "fit_period": "A_G"
    },
    {
      "name": "rank_detail_purchase",
      "position": 13,
      "dtype": "float64",
      "formula": "eq:model-source-rank: 1/(1+rank), rank starts at 1",
      "mask": "rank_detail_purchase_mask",
      "transformation": "identity",
      "provenance": {
        "entity": "request_item",
        "sources": [
          "prefix",
          "A_G"
        ],
        "available_at": "event_time <= t_q and available_time <= a_q; snapshot_time_ms < t_q",
        "version": "e3_v1",
        "missing_rule": "zero_with_mask"
      },
      "fit_period": "A_G"
    },
    {
      "name": "rank_detail_purchase_mask",
      "position": 14,
      "dtype": "bool",
      "formula": "availability(rank_detail_purchase)",
      "mask": null,
      "transformation": "identity",
      "provenance": {
        "entity": "request_item",
        "sources": [
          "prefix",
          "A_G"
        ],
        "available_at": "event_time <= t_q and available_time <= a_q; snapshot_time_ms < t_q",
        "version": "e3_v1",
        "missing_rule": "defined"
      },
      "fit_period": "A_G"
    },
    {
      "name": "origin_description",
      "position": 15,
      "dtype": "bool",
      "formula": "eq:model-source-rank: membership(description)",
      "mask": null,
      "transformation": "identity",
      "provenance": {
        "entity": "request_item",
        "sources": [
          "prefix",
          "A_G",
          "provided_metadata"
        ],
        "available_at": "event_time <= t_q and available_time <= a_q; snapshot_time_ms < t_q; ass:static-content; static_availability=unknown",
        "version": "e3_v1",
        "missing_rule": "defined"
      },
      "fit_period": "none"
    },
    {
      "name": "score_description",
      "position": 16,
      "dtype": "float64",
      "formula": "eq:model-content-score",
      "mask": "score_description_mask",
      "transformation": "identity",
      "provenance": {
        "entity": "request_item",
        "sources": [
          "prefix",
          "A_G",
          "provided_metadata"
        ],
        "available_at": "event_time <= t_q and available_time <= a_q; snapshot_time_ms < t_q; ass:static-content; static_availability=unknown",
        "version": "e3_v1",
        "missing_rule": "zero_with_mask"
      },
      "fit_period": "none"
    },
    {
      "name": "score_description_mask",
      "position": 17,
      "dtype": "bool",
      "formula": "availability(score_description)",
      "mask": null,
      "transformation": "identity",
      "provenance": {
        "entity": "request_item",
        "sources": [
          "prefix",
          "A_G",
          "provided_metadata"
        ],
        "available_at": "event_time <= t_q and available_time <= a_q; snapshot_time_ms < t_q; ass:static-content; static_availability=unknown",
        "version": "e3_v1",
        "missing_rule": "defined"
      },
      "fit_period": "none"